red;красный;She's wearing red.;Она одета в красное.
hair;волосы;My hair curls easily.;У меня слегка вьются волосы.
condition;условие, состояние;She's in good physical condition.;Она в хорошей физической форме.
wall;стена;We're building a wall.;Мы строим стену.
daughter;дочь;Bring your daughter.;Приводи свою дочь.
deal;сделка, справляться;Deal with it.;Разбирайся с этим.
author;автор;Who's the author of this story?;Кто автор этого рассказа?
truth;правда;Does truth matter?;Имеет ли правда значение?
upon;на;Science rests upon observation.;Наука основывается на наблюдении.
husband;муж;My husband is jealous.;У меня ревнивый муж.
period;период, точка;Which period of history are you studying?;Какой период истории ты изучаешь?
series;ряд, серия;They gave a series of concerts.;Они дали серию концертов.
order;заказывать, приказ;It's an order.;Это приказ.
officer;офицер;She's a police officer.;Она офицер полиции.
close;закрывать, близко;Close the window.;Закройте окно.
land;земля;They cultivated the land.;Они возделывали землю.
note;заметка;I wrote the note.;Я писал заметку.
computer;компьютер;Reboot the computer.;Перезагрузи компьютер.
thought;мысль;Everybody thought so.;Все так подумали.
economy;экономика;The Japanese economy developed rapidly.;Японская экономика развилась стремительно.
goal;цель;She achieved her goal.;Она достигла своей цели.
bank;банк, банка;I'm a bank employee.;Я банковский служащий.
behavior;поведение;Tom's behavior was unacceptable.;Поведение Тома было неприемлемым.
sound;звук, крепкий;Does this sound stupid?;Это звучит глупо?
certainly;конечно;That's certainly possible.;Это, определённо, возможно.
nearly;почти, близко;It's nearly dawn.;Уже почти рассвело.
increase;возрастать, увеличивать;They demanded a salary increase.;Они требовали повысить зарплату.
act;действовать, исполнять роль, играть;Act. Don't talk.;Делай. Не говори.
north;север ;Head north.;Двигайся на север.
blood;кровь;Blood flows through blood vessels.;Кровь течёт по кровеносным сосудам.
culture;культура;This country has a rich culture.;У этой страны богатая культура.
medical;медицинский;Do you have medical insurance?;У тебя есть медицинская страховка?
everybody;все;Everybody knows everybody.;Каждый знает каждого.
top;вершина, лучший;We climbed to the top.;Мы вскарабкались на вершину.
difficult;сложный;It was difficult.;Это было трудно.
language;язык;Choose a language.;Выберите язык.
window;окно ;Don't open the window.;Не открывайте окно.
response;ответ;Thanks for your response.;Спасибо тебе за ответ.
population;население;The population is increasing.;Население увеличивается.
lie;лежать, лгать, ложь;You wouldn't lie.;Ты бы не солгал.
tree;дерево;That's a lemon tree.;Это - лимонное дерево.
park;парковаться, парк;The parking was transformed into a park.;Парковку переделали в парк.
worker;работник, рабочий;We need more workers.;Нам нужно больше рабочих.
draw;рисовать, привлекать;Draw a straight line.;Нарисуй прямую линию.
drop;капать, ронять, капля;Drop your weapons!;Бросайте оружие!
push;толкать;Push harder.;Толкай сильнее.
Earth;земля;We live on Earth.;Мы живём на Земле.
private;персональный, частный, рядовой солдат;This is private property.;Это частная собственность.
tonight;сегодня вечером;Wait until tonight.;Подожди до вечера.
race;гонка;It was a tough race.;Это была тяжёлая гонка.
letter;письмо, буква;I received your letter.;Я получил твоё письмо.
gun;пистолет, оружие, орудие;Is your gun loaded?;У тебя ружьё заряжено?
simple;простой;That's too simple.;Это слишком просто.
wonder;удивляться, интересоваться, чудо;I wonder what happened.;Интересно, что случилось.
involve;вовлекать;I didn't want to involve her.;Я не хотел её вмешивать.
hell;ад;War is hell.;Война - это ад.
poor;бедный;Poor girl.;Бедная девочка.
answer;ответ, отвечать;Answer the question.;Ответь на вопрос.
nature;природа;He's good by nature.;Он от природы добрый.
administration;администрация;The administration approved the budget.;Администрация утвердила бюджет.
common;общий;We have common tastes.;У нас общие вкусы.
message;сообщение;Please leave a message.;Пожалуйста, оставьте сообщение.
song;песня;Please sing a song.;Пожалуйста, спой песню.
enjoy;наслаждаться;I enjoy poker.;Я обожаю покер.
similar;похожий, подобный;Something similar happened to me.;Нечто подобное случилось со мной.
congress;конгресс;The Library of Congress has a Youtube channel.;У Библиотеки Конгресса США есть канал на YouTube.
attack;атаковать, атака;Bears can attack people.;Медведи могут нападать на людей.
past;прошлое;Future needs past.;Будущее нуждается в прошлом.
hot;горячий;Yesterday was hot.;Вчера было жарко.
seek;искать;He decided to seek information elsewhere.;Он решил искать информацию в другом месте.
amount;количество, сумма;This amount includes tax.;В эту сумму включены налоги.
analysis;анализ;She persists in saying that her analysis is correct.;Она настаивает, что её анализ правильный.
store;магазин, запас, склад, хранить;The store was closed.;Магазин был закрыт.
defense;оборона;Attack is the best form of defense.;Наступление - лучшая защита.
bill;счёт;The bill, please.;Счет, пожалуйста.
cell;ячейка, мобильный телефон;Do you have a cell phone?;У тебя есть мобильный телефон?
performance;выступление, выполнение, производительность;His performance was amazing.;Его выступление было потрясающим.
hospital;больница;The hospital is crowded.;Больница переполнена.
bed;кровать;Make your bed.;Застели свою постель.
board;доска, совет, правление;Don't erase the board.;Не стирай с доски.
protect;защищать;Tom will protect you.;Том тебя защитит.
century;век;A century is one hundred years.;Век — это сто лет.
summer;лето;Summer has ended.;Лето закончилось.
material;материал, материальный;This material stretches easily.;Этот материал легко тянется.
individual;личный, личность;He's a rather rare individual.;Он довольно редкий индивидуум.
recently;недавно;They moved here recently.;Они переехали сюда недавно.
example;пример;Give me another example.;Приведи мне другой пример.
represent;представлять;I represent an American firm.;Я представляю американскую фирму.
fill;наполнять;Fill the bucket with water.;Наполни ведро водой.
animal;животное, животный;Is this animal holy?;Это животное священно?
fail;потерпеть неудачу, провал;We can't fail again.;Мы не можем потерпеть неудачу снова.
factor;фактор;Health is an important factor of happiness.;Здоровье - важный фактор счастья.
natural;естественный, природный;It's completely natural.;Это совершенно естественно.
sir;сэр;Your table is ready, sir.;Ваш столик готов, сэр.
agency;агентство;Tom started an advertising agency.;Том основал рекламное агентство.
usually;обычно;We usually win.;Мы обычно побеждаем.
significant;значительный;This product has significant shortcomings.;У этого продукта есть существенные недостатки.
ability;способность;He overestimated his ability.;Он переоценил свои возможности.
mile;миля;The bridge is approximately a mile long.;Мост примерно в милю длинной.
statement;высказывание, утверждение;I have a brief statement.;У меня короткое заявление.
entire;полный, весь;The entire town was under water.;Весь город был под водой.
democrat;демократ;Democrats and Republicans worked together.;Демократы и республиканцы работали вместе.
floor;пол, этаж;Sweep the floor.;Подмети пол.
serious;серьёзный;It's nothing serious.;Ничего серьёзного.
career;карьера;His political career has ended.;Его политическая карьера закончилась.
dollar;доллар;How much is the dollar now?;Сколько сейчас стоит доллар?
vote;голос, голосование;Everybody should vote.;Все должны голосовать.
compare;сравнивать;Don't compare yourself to them.;Не сравнивай себя с ними.
south;юг;I'm from South Korea.;Я из Южной Кореи.
forward;дальше, вперед;Take another step forward.;Сделай ещё шаг вперёд.
subject;тема, подчиненный;Change the subject.;Смени тему.
financial;финансовый;Will I receive financial aid?;Я получу финансовую помощь?
identify;идентифицировать;Can you identify the problem areas?;Ты можешь определить проблемные места?
beautiful;красивый;That is beautiful.;Это красиво.
decade;десятилетие;I've been working here for many decades.;Я уже много десятков лет работаю здесь.
bit;кусочек, частица;Wait a bit.;Подожди чуть-чуть.
reduce;сокращать;That would reduce costs.;Это сократило бы расходы.
sister;сестра;She's his sister.;Она его сестра.
quality;качество;The quality of translation has improved.;Качество перевода улучшилось.
quickly;быстро;Squirrels move quickly.;Белки быстро двигаются.
press;нажимать;Press the button.;Нажми на кнопку.
worry;беспокоиться;Don't worry.;Не волнуйся.
accept;принимать;I accept your apology.;Я принимаю ваши извинения.
enter;ввод;Enter your password.;Введите пароль.
mention;упоминать;Don't even mention it.;Даже не упоминай об этом.
thus;следовательно, таким образом;Thus, the tyrant succeeded in conquering the kingdom.;Таким образом, тирану удалось захватить королевство.
plant;растение, сажать;Plant a tree over here.;Посади дерево вон там.
movement;движение;Squirrels are quick of movement.;Белки двигаются быстро.
scene;сцена;I'm imagining that scene.;Я представляю себе эту сцену.
section;часть, отдел, раздел;Skip that section.;Пропустите этот раздел.
treatment;лечение, обращение;The treatment is going successfully.;Лечение идёт успешно.
wish;желать;As you wish.;Как пожелаете.
benefit;выгода;Yoga has many health benefits.;Йога даёт много пользы для здоровья.
interesting;интересный ;It seems interesting.;Выглядит интересно.
west;запад;The giraffe herd headed West.;Стадо жирафов направилось на запад.
candidate;кандидат;What candidate should I vote for?;За какого кандидата мне голосовать?
approach;подход;I suggest a different approach.;Я предлагаю другой подход.
determine;определять;We weren't able to determine her whereabouts.;Мы не смогли определить её местонахождение.
resource;ресурсы;Time is the most valuable resource a person possesses.;Время – ценнейший ресурс, которым владеет человек.
claim;утверждать, требовать;Fight oppression, claim your freedom.;Борись с угнетением, требуй свободу.
prove;доказывать;That doesn't prove anything.;Это ничего не доказывает.
sort;сортировать, тип, разновидность;This sort of thing happens.;Такого рода вещи случаются.
size;размер;What size are you?;Какой у тебя размер?
somebody;кто-то;Somebody just called.;Кто-то только что звонил.
knowledge;знания;I get knowledge by reading books.;Я получаю знания, читая книги.
rather;довольно, до некоторой степени, скорее;That is rather unexpected.;Это довольно неожиданно.
hang;вешать;Clouds hang in the air.;Облака висят в воздухе.
sport;спорт;Sport knows no borders.;Спорт не знает границ.
TV;телевизор, телевидение;Don't watch TV.;Не смотри телевизор.
loss;потеря;Tom's diet resulted in weight loss.;Диета Тома привела к потере веса.
argue;спорить;Some people argue just for the sake of arguing.;Некоторые люди спорят только для того, чтобы спорить.
left;левый;We left together.;Мы ушли вместе.
meeting;совещание, встреча;The meeting was canceled.;Встреча была отменена.
skill;навык, мастерство;Fluency in English is a very marketable skill today.;Свободное владение английским сейчас очень востребованный навык.
card;карта;Please insert your card.;Пожалуйста, вставьте карту.
feeling;чувство;I'm feeling tired.;Я чувствую себя уставшим.
despite;несмотря на;He succeeded, despite the difficulties.;Он преуспел, несмотря на трудности.
degree;степень, градус;She received a doctor's degree.;Она получила докторскую степень.
crime;преступление;It's not a crime.;Это не преступление.
sign;подпись, знак;Just sign here.;Просто подпишите здесь.
occur;происходить, приходить на ум;Did it not occur to you to close the windows?;Тебе не пришло в голову закрыть окна?
imagine;воображать;Can you imagine that?;Можешь себе это представить?
near;близкий, около;Don't stand near me.;Не стой рядом со мной.
king;корольь;The king is ill.;Король болен.
box;коробка, бокс;The box is empty.;Коробка пуста.
present;настоящее, дарить, подарок;Choose a present carefully.;Выбирай подарок тщательно.
seven;семь;Seven dollars, please.;Семь долларов, пожалуйста.
foreign;иностранный;We encourage foreign investment.;Мы поощряем иностранные инвестиции.
laugh;смеяться;Don't make me laugh.;Не смеши меня.
disease;заболевание;Doctors are fighting against disease.;Врачи борются с болезнью.
lady;дама, леди;Not so fast, young lady!;Не так быстро, юная леди!
beyond;за пределами,;It's beyond my comprehension.;Это за гранью моего понимания.
discuss;обсуждать;Let's discuss this later.;Давайте обсудим это позже.
finish;заканчивать;Let him finish.;Позвольте ему закончить.
design;проектирование, проектировать, дизайн;What a beautiful design!;Какой красивый дизайн!
concern;беспокойство, беспокоить, затрагивать;Thanks for your concern.;Спасибо за беспокойство.
ball;мяч;Catch the ball.;Лови мяч.
east;восток;The moon rises in the east.;Луна восходит на востоке.
recognize;признавать, осознавать;I didn't recognize you.;Я тебя не узнал.
apply;обращаться с заявлением, касаться, применять;Rules apply to everyone.;Правила касаются всех.
prepare;готовиться, готовить;Prepare for combat.;Готовьтесь к бою.
network;сеть;Their job is to connect the computers to the network.;Их работа — подключать компьютеры к сети.
huge;огромный;The demand is huge.;Спрос огромен.
success;успех;Careful preparations ensure success.;Внимательная подготовка гарантирует успех.
district;район, квартал;This district is notorious for air pollution.;Этот район печально знаменит загрязнением воздуха.
cup;чашка;Have another cup.;Выпей ещё чашечку.
physical;физический;He's in good physical condition.;Он в хорошей физической форме.
growth;рост;More money for education will spur economic growth.;Больше денег на образование будет стимулировать экономический рост.
rise;подниматься, увеличиваться;Prices continued to rise.;Цены продолжили расти.
hi;привет;Hi, everybody!;Всем привет!
standard;стандарт, стандартный;It's standard procedure.;Это стандартная процедура.
fan;вентилятор, фанат;The fan is making noise.;Вентилятор шумит.
theory;теория;That's an interesting theory.;Это интересная теория.
staff;персонал;Staff members only.;Вход только для персонала.
hurt;причинить боль, ранить;Tom was hurt.;Том был ранен.
legal;правовой, законный;I know my legal rights.;Я знаю свои законные права.
September;сентябрь;Thirty days has September, April, June and November.;Тридцать дней бывает в сентябре, апреле, июне и ноябре.
outside;снаружи, наружний;It's raining outside.;Снаружи идёт дождь.
strategy;стратегия;We need a new strategy.;Нам нужна новая стратегия.
clearly;ясно, очевидно;It is clearly inevitable.;Это, очевидно, неизбежно.